{
  "title": "할 일 관리 서비스",
  "summary": "개인 사용자가 할 일을 등록하고 카테고리별로 분류해 완료 여부와 마감일을 관리하는 서비스입니다.",
  "goals": [
    "할 일을 빠르게 등록하고 한눈에 확인한다",
    "완료 여부와 마감일로 할 일의 진행 상황을 관리한다",
    "카테고리로 할 일을 분류한다"
  ],
  "targetUsers": [
    { "name": "개인 사용자", "description": "업무와 개인 생활의 할 일을 한곳에서 관리하려는 사람" }
  ],
  "features": [
    {
      "id": "F-001",
      "name": "할 일 등록",
      "description": "제목, 메모, 마감일을 입력해 할 일을 등록한다.",
      "priority": "MUST",
      "acceptanceCriteria": [
        "제목 없이 등록하면 오류가 표시된다",
        "메모와 마감일은 입력하지 않아도 등록된다"
      ]
    },
    {
      "id": "F-002",
      "name": "할 일 목록 조회",
      "description": "등록된 할 일 전체를 목록으로 본다.",
      "priority": "MUST",
      "acceptanceCriteria": [
        "목록에 제목, 마감일, 완료 여부, 카테고리가 보인다"
      ]
    },
    {
      "id": "F-003",
      "name": "할 일 수정",
      "description": "할 일의 제목, 메모, 마감일, 카테고리를 수정하고 완료 여부를 체크한다.",
      "priority": "MUST",
      "acceptanceCriteria": [
        "수정한 내용이 목록에 바로 반영된다",
        "완료 체크와 해제를 할 수 있다"
      ]
    },
    {
      "id": "F-004",
      "name": "할 일 삭제",
      "description": "할 일을 삭제한다.",
      "priority": "MUST",
      "acceptanceCriteria": [
        "삭제한 할 일은 목록에서 사라진다"
      ]
    },
    {
      "id": "F-005",
      "name": "카테고리 관리",
      "description": "카테고리를 추가하고 삭제하며 목록을 본다.",
      "priority": "SHOULD",
      "acceptanceCriteria": [
        "같은 이름의 카테고리는 두 번 만들 수 없다",
        "카테고리 목록을 볼 수 있다"
      ]
    },
    {
      "id": "F-006",
      "name": "할 일 카테고리 분류",
      "description": "할 일을 등록하거나 수정할 때 카테고리를 하나 지정한다.",
      "priority": "SHOULD",
      "acceptanceCriteria": [
        "카테고리를 지정하지 않은 할 일도 등록할 수 있다",
        "없는 카테고리를 지정하면 오류가 표시된다"
      ]
    }
  ],
  "nonFunctionalRequirements": [],
  "outOfScope": [
    "마감일 알림 (요구사항에서 이후 기능으로 언급됨)",
    "로그인과 여러 사용자 지원 (개인용 서비스)"
  ]
}
